[
  {"handle": "1", "object_name": "AcDbLine", "entity_type": "LINE", "layer": "COL", "color": 7, "start": [0, 0, 0], "end": [0, 5000, 0]},
  {"handle": "2", "object_name": "AcDbLine", "entity_type": "LINE", "layer": "WAL1", "color": 7, "start": [1000, 0, 0], "end": [1000, 5000, 0]},
  {"handle": "3", "object_name": "AcDbPolyline", "entity_type": "LWPOLYLINE", "layer": "WAL2", "color": 3, "points": [[0, 0, 0], [3000, 0, 0], [3000, 200, 0], [0, 200, 0]], "closed": true, "area": 600000},
  {"handle": "4", "object_name": "AcDbLine", "entity_type": "LINE", "layer": "ELE", "color": 8},
  {"handle": "5", "object_name": "AcDbLine", "entity_type": "LINE", "layer": "ELE1", "color": 251},
  {"handle": "6", "object_name": "AcDbLine", "entity_type": "LINE", "layer": "ELE2", "color": 252},
  {"handle": "7", "object_name": "AcDbBlockReference", "entity_type": "INSERT", "layer": "DOOR", "name": "D900", "effective_name": "D900", "insert": [1500, 0, 0]},
  {"handle": "8", "object_name": "AcDbBlockReference", "entity_type": "INSERT", "layer": "WIN", "name": "W1200", "effective_name": "W1200", "insert": [2500, 0, 0]},
  {"handle": "9", "object_name": "AcDbLine", "entity_type": "LINE", "layer": "WINBAR", "color": 7},
  {"handle": "10", "object_name": "AcDbLine", "entity_type": "LINE", "layer": "WINELE", "color": 7},
  {"handle": "11", "object_name": "AcDbBlockReference", "entity_type": "INSERT", "layer": "STAIR", "name": "STAIR01", "effective_name": "STAIR01"},
  {"handle": "12", "object_name": "AcDbDimension", "entity_type": "DIMENSION", "layer": "DIM", "color": 256},
  {"handle": "13", "object_name": "AcDbLine", "entity_type": "LINE", "layer": "DIMLE", "color": 256},
  {"handle": "14", "object_name": "AcDbLine", "entity_type": "LINE", "layer": "CEN", "color": 1},
  {"handle": "15", "object_name": "AcDbLine", "entity_type": "LINE", "layer": "CEN1", "color": 1},
  {"handle": "16", "object_name": "AcDbLine", "entity_type": "LINE", "layer": "CEN2", "color": 1},
  {"handle": "17", "object_name": "AcDbLine", "entity_type": "LINE", "layer": "DEFPOINTS", "color": 7},
  {"handle": "18", "object_name": "AcDbBlockReference", "entity_type": "INSERT", "layer": "FIX", "name": "WC", "effective_name": "WC"},
  {"handle": "19", "object_name": "AcDbBlockReference", "entity_type": "INSERT", "layer": "FUR", "name": "CHAIR", "effective_name": "CHAIR"},
  {"handle": "20", "object_name": "AcDbLine", "entity_type": "LINE", "layer": "SYM", "color": 2},
  {"handle": "21", "object_name": "AcDbText", "entity_type": "TEXT", "layer": "SYM_T", "text": "SECTION A"},
  {"handle": "22", "object_name": "AcDbText", "entity_type": "TEXT", "layer": "TIT", "text": "1F PLAN"},
  {"handle": "23", "object_name": "AcDbPolyline", "entity_type": "LWPOLYLINE", "layer": "AREA", "closed": true, "points": [[0, 0, 0], [10000, 0, 0], [10000, 10000, 0], [0, 10000, 0]], "area": 100000000},
  {"handle": "24", "object_name": "AcDbLine", "entity_type": "LINE", "layer": "PARKING", "color": 4},
  {"handle": "25", "object_name": "AcDbLine", "entity_type": "LINE", "layer": "INS", "color": 6},
  {"handle": "26", "object_name": "AcDbPolyline", "entity_type": "LWPOLYLINE", "layer": "BOUND", "closed": true, "area": 3000000},
  {"handle": "27", "object_name": "AcDbPolyline", "entity_type": "LWPOLYLINE", "layer": "A-FORM", "closed": true},
  {"handle": "28", "object_name": "AcDbCircle", "entity_type": "CIRCLE", "layer": "MARK", "radius": 100},
  {"handle": "29", "object_name": "AcDbLine", "entity_type": "LINE", "layer": "UNKNOWN_LAYER", "color": 2},
  {"handle": "30", "object_name": "AcDbLine", "entity_type": "LINE", "layer": "ETC4", "color": 1}
]
